"doc_id","text","timestamp","team","region","year","month","day","weekday","hour"
1187973046977482752,"mike pence has accused nike of   checking its social conscience at the door   for removing houston rockets merchandise from its<u+2026>",2019-10-26 06:03:40,"Houston Rockets","Southwest",2019,"Oct",26,"Sat",6
1293326093777350656,"lebron james writes special liverpool message as nike power shown  la lakers superstar<u+2026>",2020-08-11 23:19:04,"LA Lakers","Pacific",2020,"Aug",11,"Tue",23
1261695539944452096,"kingjames  kingjames we know you are busy bro but tell nike to restock the media day 7s dawg  idk anybody who was<u+2026>",2020-05-16 16:30:32,"LA Lakers","Pacific",2020,"May",16,"Sat",16
1262270278454751232,"michael jordan made $90 million in salary in the nba career   he now makes more than that every year from nike   he owns<u+2026>",2020-05-18 06:34:20,"Charlotte Hornets","Southeast",2020,"May",18,"Mon",6
1262496755288911872,"michael jordan made $90 million in salary in the nba career   he now makes more than that every year from nike   he owns<u+2026>",2020-05-18 21:34:17,"Charlotte Hornets","Southeast",2020,"May",18,"Mon",21
1290610965491277824,"go kings go25  gematriaclub  nba  espnnba  nbaontnt  nbatv  nbabubblelife  nikebasketball  disneyparks<u+2026>",2020-08-04 11:30:07,"Orlando Magic","Southeast",2020,"Aug",4,"Tue",11
1196145532395085824,"check out what i just added to my closet on poshmark  nike air lebron 6 charlotte hornets",2019-11-17 19:18:12,"Charlotte Hornets","Southeast",2019,"Nov",17,"Sun",19
1226058174752591872,"the chicago bulls retro pinstripe jerseys inspire this nike air force 1 jewel  sneakerhead",2020-02-08 08:20:22,"Chicago Bulls","Central",2020,"Feb",8,"Sat",8
1288603242721505280,"women s boston  celtics jayson tatum nike kelly green swingman jersey   icon edition  nba  ladies  freeshipping",2020-07-29 22:32:08,"Boston Celtics","Atlantic",2020,"Jul",29,"Wed",22
1316055633091682304,"it<u+2019>s so petty watching  nike drop chicago bulls merch and seeing jordan try to take the shine from  lakers  amp   kingjames lol",2020-10-13 16:38:08,"Chicago Bulls","Central",2020,"Oct",13,"Tue",16
1296216398935609344,"joe harris of the brooklyn nets wearing the undftd x nike kobe 5 protro against toronto",2020-08-19 22:44:06,"Brooklyn Nets","Atlantic",2020,"Aug",19,"Wed",22
1196464213906116608,"check out nba atlanta hawks nike 74 warm up shoot around full button jersey men s size 4xl  nike",2019-11-18 16:24:32,"Atlanta Hawks","Southeast",2019,"Nov",18,"Mon",16
1262230638972801024,"michael jordan made $90 million in salary in the nba career   he now makes more than that every year from nike   he owns<u+2026>",2020-05-18 03:56:50,"Charlotte Hornets","Southeast",2020,"May",18,"Mon",3
1222156685084712960,"purchase with the intent to show your support and respects to the legend    nike kobe la lakers iconic moments <u+2018>81 points<u+2019><u+2026>",2020-01-28 13:57:14,"LA Lakers","Pacific",2020,"Jan",28,"Tue",13
1304559882922795008,"the nike air max 95 is releasing soon in memphis grizzlies colors",2020-09-11 23:18:08,"Memphis Grizzlies","Southwest",2020,"Sep",11,"Fri",23
1187871795845709824,"mike pence has accused nike of   checking its social conscience at the door   for removing houston rockets merchandise from its<u+2026>",2019-10-25 23:21:20,"Houston Rockets","Southwest",2019,"Oct",25,"Fri",23
1310931400057552896,"so i ve been contemplating buying a bulls vest from  nike for 1pon5 then i m strawling the isles at  pepstores sa m<u+2026>",2020-09-29 13:16:16,"Chicago Bulls","Central",2020,"Sep",29,"Tue",13
1223305485081890816,"nike houston rockets james harden jersey sz large 48  nba red white swingman $110  sports",2020-01-31 18:02:10,"Houston Rockets","Southwest",2020,"Jan",31,"Fri",18
1262388648332464128,"michael jordan made $90 million in salary in the nba career   he now makes more than that every year from nike   he owns<u+2026>",2020-05-18 14:24:42,"Charlotte Hornets","Southeast",2020,"May",18,"Mon",14
1276263057816256512,"<u+201c>vinsanity<u+201d> jumped over frederic weis while in the nike shox bb4 during the 2000 summer olympic games in what is known as<u+2026>",2020-06-25 21:16:39,"New York Knicks","Atlantic",2020,"Jun",25,"Thu",21
1262392711308546048,"michael jordan made $90 million in salary in the nba career   he now makes more than that every year from nike   he owns<u+2026>",2020-05-18 14:40:51,"Charlotte Hornets","Southeast",2020,"May",18,"Mon",14
1316056119358480384,"chicago bulls swingman shorts dropped via nike us <u+0001f3c0>  black   gt  red   gt  w<u+2026>",2020-10-13 16:40:04,"Chicago Bulls","Central",2020,"Oct",13,"Tue",16
1309271992529346560,"leaked  photos of the new toronto  raptors uniform for the 2020 21 season   nba  nike   this is a full time multi seaso<u+2026>",2020-09-24 23:22:22,"Toronto Raptors","Atlantic",2020,"Sep",24,"Thu",23
1275629095351697408,"this nba x nike  okcthunder therma flex showtime hoodie is well over 50  off at $60 97 + get free shipping with your nike+<u+2026>",2020-06-24 03:17:31,"Oklahoma City Thunder","Northwest",2020,"Jun",24,"Wed",3
1199715665239785472,"5<u+fe0f><u+20e3>0<u+fe0f><u+20e3> years in the land     get your  cavs nike nba city editio<u+2026>",2019-11-27 15:44:38,"Cleveland Cavaliers","Central",2019,"Nov",27,"Wed",15
1182598912298889216,"wait  i thought nike was <u+201c>woke and all     <u+0001f447><u+0001f3fb> <u+201c>nike pulls houston rockets merchandise from chinese stores<u+201d>",2019-10-11 10:08:46,"Houston Rockets","Southwest",2019,"Oct",11,"Fri",10
1304975099221676032,"check out brooklyn nets kevin durant  7 nike white nba 2019 20 swingman association jersey  nike<u+2026>",2020-09-13 02:48:03,"Brooklyn Nets","Atlantic",2020,"Sep",13,"Sun",2
1289016490168115200,"<u+0001f455>nike jayson tatum icon edition swingman  boston celtics   <u+0001f6d2> 3 100 thb  <u+0001fa73> sweeks <u+201c>logo<u+201d> dyed short  color black white  <u+0001f6d2>1<u+2026>",2020-07-31 01:54:14,"Boston Celtics","Atlantic",2020,"Jul",31,"Fri",1
1280514217632763904,"nike air jordan retro 10  charlotte hornets <u+00a0> sz 13 5 brand new<u+00a0>",2020-07-07 14:49:14,"Charlotte Hornets","Southeast",2020,"Jul",7,"Tue",14
1246999137624535040,"check out what i just added to my closet on poshmark  nwt nike golden state warriors  30 stephen curry <u+2026>",2020-04-06 03:12:17,"Golden State Warriors","Pacific",2020,"Apr",6,"Mon",3
1187635097425633280,"pence also criticized footwear giant nike for pulling houston rockets merchandise in china <u+2026>",2019-10-25 07:40:47,"Houston Rockets","Southwest",2019,"Oct",25,"Fri",7
1264660920011313152,"nike that s why stephen curry will always overshadow lebron james no matter how good lebron james thinks he is  i<u+2026>",2020-05-24 20:53:54,"LA Clippers","Pacific",2020,"May",24,"Sun",20
1252470463764271104,"check out kobe bryant  24 la lakers black mamba city aj6432 011 swingman jersey sz 56 xxl  nike",2020-04-21 05:33:22,"LA Lakers","Pacific",2020,"Apr",21,"Tue",5
1295679132538482688,"concours nba toronto raptors jersey 52 wins <u+2705>  nbachallengefr2  grizzliesfr  gagnez le maillot nike city edition de lowry <u+0001f9ec><u+2026>",2020-08-18 11:09:12,"Toronto Raptors","Atlantic",2020,"Aug",18,"Tue",11
1319831180678758400,"travis scott has now done brand collaborations with     mcdonald<u+2019>s   playstation    fortnite    reese<u+2019>s puffs   nike    h<u+2026>",2020-10-24 02:40:49,"Houston Rockets","Southwest",2020,"Oct",24,"Sat",2
1197345149229162496,"check out jerome williams  autograph toronto raptors jersey size xl  nike  torontoraptors",2019-11-21 02:45:03,"Toronto Raptors","Atlantic",2019,"Nov",21,"Thu",2
1269785079460564992,"custom  nuggets jersey  milehighbasketball         customsbythebrandlabel |  basketball |  denver |  nba |  nike |  sw<u+2026>",2020-06-08 00:15:29,"Denver Nuggets","Northwest",2020,"Jun",8,"Mon",0
1308009350158528512,"check out what i just added to my closet on poshmark  nike air max uptempo  95   chicago bulls    v<u+2026>",2020-09-21 11:45:05,"Chicago Bulls","Central",2020,"Sep",21,"Mon",11
1262242017784090624,"michael jordan made $90 million in salary in the nba career   he now makes more than that every year from nike   he owns<u+2026>",2020-05-18 04:42:03,"Charlotte Hornets","Southeast",2020,"May",18,"Mon",4
1319846159922376704,"travis scott has now done brand collaborations with     mcdonald<u+2019>s   playstation    fortnite    reese<u+2019>s puffs   nike    h<u+2026>",2020-10-24 03:40:20,"Houston Rockets","Southwest",2020,"Oct",24,"Sat",3
1208117187040301056,"nba  nikebasketball denver nuggets vs  detroit pistons",2019-12-20 20:09:17,"Denver Nuggets","Northwest",2019,"Dec",20,"Fri",20
1210321096333025280,"the concepts x nike kyrie 6 khepri will be available to game day ticket holders for the nets vs knicks game tonight  12 26  at<u+2026>",2019-12-26 22:06:50,"New York Knicks","Atlantic",2019,"Dec",26,"Thu",22
1253192982318047232,"earlier today  a federal judge ruled against la clippers  star kawhi leonard and his claims that nike unlawfully copyright<u+2026>",2020-04-23 05:24:24,"LA Clippers","Pacific",2020,"Apr",23,"Thu",5
1303616919434600448,"concours nba toronto raptors jersey 52 wins <u+2705>  nbachallengefr2  grizzliesfr  gagnez le maillot nike city edition de lowry <u+0001f9ec><u+2026>",2020-09-09 08:51:08,"Toronto Raptors","Atlantic",2020,"Sep",9,"Wed",8
1275297329424281600,"sale $33 97 chicago bulls nike t shirt on nike us    ad",2020-06-23 05:19:11,"Chicago Bulls","Central",2020,"Jun",23,"Tue",5
1.321847010476e+18,"dragonsquatch  spida4ever  djhoneypawz the issue here isn t new orleans or even the pelicans  it s nike  these dud<u+2026>",2020-10-29 16:11:00,"New Orleans Pelicans","Southwest",2020,"Oct",29,"Thu",16
1182985083835297792,"nike s  honest  slogan  believe in something   even if it means sacrificing everything     terms and conditions may ch<u+2026>",2019-10-12 11:43:17,"Houston Rockets","Southwest",2019,"Oct",12,"Sat",11
1195477522873569280,"check out steph curry golden state warriors nike dri fit jersey t shirt xl athletic cut  nike",2019-11-15 23:03:47,"Golden State Warriors","Pacific",2019,"Nov",15,"Fri",23
1262358936935636992,"michael jordan made $90 million in salary in the nba career   he now makes more than that every year from nike   he owns<u+2026>",2020-05-18 12:26:38,"Charlotte Hornets","Southeast",2020,"May",18,"Mon",12
1199707701967806464,"the city of influencers  <u+0001f351>   get your  atlhawks nike nba city edition jersey now <u+27a1><u+fe0f>",2019-11-27 15:13:00,"Atlanta Hawks","Southeast",2019,"Nov",27,"Wed",15
1224504346114576384,"throughout february  the  pacers will wear the nike  blackhistorymonth warmup shirts  the dri fit t shirt features wor<u+2026>",2020-02-04 01:26:00,"Indiana Pacers","Central",2020,"Feb",4,"Tue",1
1316055044479873024,"live via nike us  jordan chicago bulls statement shorts  2020    buy here",2020-10-13 16:35:48,"Chicago Bulls","Central",2020,"Oct",13,"Tue",16
1207184704665014272,"de<u+2019>aaron fox laced up in a couple of og nike hyperdunks  one of which paid homage to the philippines  in his return<u+2026>",2019-12-18 06:23:56,"Sacramento Kings","Pacific",2019,"Dec",18,"Wed",6
1313657441868017664,"nike nba chicago bulls icon edition shorts  fanatics nbastore  ad",2020-10-07 01:48:35,"Chicago Bulls","Central",2020,"Oct",7,"Wed",1
1191626321585037312,"kyrie irving channels his creativity with the nike kyrie 6 the brooklyn nets star debuts his latest signature shoe <u+2026>",2019-11-05 08:00:29,"Brooklyn Nets","Atlantic",2019,"Nov",5,"Tue",8
1258509763152760832,"the list of all the iconic nikes penny hardaway wore during his time with the orlando magic and phoenix suns is long  but<u+2026>",2020-05-07 21:31:24,"Orlando Magic","Southeast",2020,"May",7,"Thu",21
1182606978721419264,"managers at five nike stores in beijing and shanghai told reuters during visits on thursday they had been told in recent d<u+2026>",2019-10-11 10:40:50,"Houston Rockets","Southwest",2019,"Oct",11,"Fri",10
1179855552257519616,"realwoopig  gb theprophet  nike anklebully  phatmacalot  tgo2223  fvshinwave  thenbacentral the jazz  you<u+2019>re kiddi<u+2026>",2019-10-03 20:27:38,"Denver Nuggets","Northwest",2019,"Oct",3,"Thu",20
1316946185614249984,"check out miami heat tyler herro  14 nike vicewave nba swingman jersey   city edition  nike",2020-10-16 03:36:52,"Miami Heat","Southeast",2020,"Oct",16,"Fri",3
1262238550088613888,"michael jordan made $90 million in salary in the nba career   he now makes more than that every year from nike   he owns<u+2026>",2020-05-18 04:28:16,"Charlotte Hornets","Southeast",2020,"May",18,"Mon",4
1256841946741518336,"nike kd 13   black grey   a k a   brooklyn nets   the shoes are available at our online store   gt <u+2026>",2020-05-03 07:04:05,"Brooklyn Nets","Atlantic",2020,"May",3,"Sun",7
1269607350798815232,"air jordan retro 1 chicago bulls 2012 nike aj1 red black white size 10",2020-06-07 12:29:15,"Chicago Bulls","Central",2020,"Jun",7,"Sun",12
1273748403466514432,"basketball lovers  nike air force 1s  la lakers  22000  free delivery nationwide free cotton socks and an extra pair of laces<u+2026>",2020-06-18 22:44:19,"LA Lakers","Pacific",2020,"Jun",18,"Thu",22
1199690131244044288,"check out jerome williams  autograph toronto raptors jersey size xl  nike  torontoraptors",2019-11-27 14:03:11,"Toronto Raptors","Atlantic",2019,"Nov",27,"Wed",14
1286243966636130304,"nba  celtics  boston celtics nike warm up pants size medium",2020-07-23 10:17:13,"Boston Celtics","Atlantic",2020,"Jul",23,"Thu",10
1281634437227139072,"<u+0001f4a5>jersey sale<u+0001f4a5> 50  off all current nike jazz jerseys<u+203c><u+fe0f><u+0001f3c3><u+200d><u+2642><u+fe0f>  <u+0001f3c0> in store through saturday <u+0001f3c0> online through sunday<u+2026>",2020-07-10 17:00:36,"Utah Jazz","Northwest",2020,"Jul",10,"Fri",17
1.208116750254e+18,"nba  nikebasketball denver nuggets and detroit pistons  nbaxmas  sweepstakes",2019-12-20 20:07:33,"Denver Nuggets","Northwest",2019,"Dec",20,"Fri",20
1318300273274748928,"2003 04 kobe bryant la lakers game used  amp  autographed nike air huarache shoes  photo matched <u+00a0><u+0001f4af>  kobebryant  justconsigned<u+2026>",2020-10-19 21:17:32,"LA Lakers","Pacific",2020,"Oct",19,"Mon",21
1296784764280754176,"coachdre3000  ajcanfield  tbnike612 i doubt it is  would you trade kat to phoenix for the 1 this year  some more p<u+2026>",2020-08-21 12:22:35,"Phoenix Suns","Pacific",2020,"Aug",21,"Fri",12
1191759193759518720,"227 s<u+2122> youtube chili   nike spicy   nba mix   rockets",2019-11-05 16:48:28,"Houston Rockets","Southwest",2019,"Nov",5,"Tue",16
1208116520238362624,"nba  nikebasketball denver nuggets and detroit pistons",2019-12-20 20:06:38,"Denver Nuggets","Northwest",2019,"Dec",20,"Fri",20
1290401761996541952,"<u+27a1><u+fe0f>does anyone think the nba will learn  <u+0001f19a>nike canceling more jersey sales  <u+0001f6ab>or will lust for china  amp  hatred of america win  <u+0001f62a>sa<u+2026>",2020-08-03 21:38:49,"Orlando Magic","Southeast",2020,"Aug",3,"Mon",21
1304191401425428480,"the nike air max 95 is releasing soon in memphis grizzlies colors",2020-09-10 22:53:55,"Memphis Grizzlies","Southwest",2020,"Sep",10,"Thu",22
1320470236013973504,"over 40  off <u+0001f3c0>  black heather  nba x nike therma flex showtime hoodies are $80 97 each + get free shipping with you<u+2026>",2020-10-25 21:00:12,"Golden State Warriors","Pacific",2020,"Oct",25,"Sun",21
1223074711434862592,"atlanta hawks evp and cro andrew saltzman presented 92 9<u+2019>s terry foxx with a customized 2019 2020 nike city edition peachtree<u+2026>",2020-01-31 02:45:09,"Atlanta Hawks","Southeast",2020,"Jan",31,"Fri",2
1289101487189053440,"<u+0001f455>nike jayson tatum icon edition swingman  boston celtics   <u+0001f6d2> 3 100 thb  <u+0001fa73> sweeks <u+201c>logo<u+201d> dyed short  color black white  <u+0001f6d2>1<u+2026>",2020-07-31 07:31:59,"Boston Celtics","Atlantic",2020,"Jul",31,"Fri",7
1263690461618688000,"check out nike lebron james denim jeans nba cleveland cavaliers 34 x 30 nwt msrp $85  nike",2020-05-22 04:37:38,"Cleveland Cavaliers","Central",2020,"May",22,"Fri",4
1179221973420969984,"this nike lebron 16 features a pastel purple upper  amp  rubber sole with darker tones of purple uses on the branding e<u+2026>",2019-10-02 02:30:02,"LA Lakers","Pacific",2019,"Oct",2,"Wed",2
1208058782909128704,"orlando magic unveil its nike<u+00a0>earned edition<u+00a0>warm up",2019-12-20 16:17:13,"Orlando Magic","Southeast",2019,"Dec",20,"Fri",16
1208116869485473792,"nba  nikebasketball detroit pistons and denver nuggets",2019-12-20 20:08:02,"Denver Nuggets","Northwest",2019,"Dec",20,"Fri",20
1183114828627533824,"consider it a delightful moniker  however from seattle  bill and melinda gates foundation amazon  to los angeles  t<u+2026>",2019-10-12 20:18:51,"Golden State Warriors","Pacific",2019,"Oct",12,"Sat",20
1320071969019097088,"travis scott has now done brand collaborations with     mcdonald<u+2019>s   playstation    fortnite    reese<u+2019>s puffs   nike    h<u+2026>",2020-10-24 18:37:37,"Houston Rockets","Southwest",2020,"Oct",24,"Sat",18
1292692249076043776,"check out what i just added to my closet on poshmark  nike orlando magic city edition sweatshirt l <u+2026>",2020-08-10 05:20:23,"Orlando Magic","Southeast",2020,"Aug",10,"Mon",5
1262383818830479360,"michael jordan made $90 million in salary in the nba career   he now makes more than that every year from nike   he owns<u+2026>",2020-05-18 14:05:31,"Charlotte Hornets","Southeast",2020,"May",18,"Mon",14
1278810418522271744,"check out shabazz napier nike dri fit swingman brooklyn nets jersey   youth l 14 16  ebay",2020-07-02 21:58:57,"Brooklyn Nets","Atlantic",2020,"Jul",2,"Thu",21
1208124109269454848,"nba  nikebasketball denver nuggets and detroit pistons  sweepstakes  nbaxmas",2019-12-20 20:36:48,"Denver Nuggets","Northwest",2019,"Dec",20,"Fri",20
1182618056444563456,"nike  the business that chose kaepernick as a spokesman  pulls rockets gear from its china stores  per reuters",2019-10-11 11:24:51,"Houston Rockets","Southwest",2019,"Oct",11,"Fri",11
1291037288328310784,"nike kd 13 arriving in brooklyn nets colors",2020-08-05 15:44:10,"Brooklyn Nets","Atlantic",2020,"Aug",5,"Wed",15
1312589456126418944,"ad  sale $33 75 men s nike bulls dri fit pract shorts via dsg  retail $45",2020-10-04 03:04:47,"Chicago Bulls","Central",2020,"Oct",4,"Sun",3
1244431064317206528,"nike men s new orleans pelicans brandon ingram  14 dri fit navy icon t shirt | dick s sporting goods",2020-03-30 01:07:40,"New Orleans Pelicans","Southwest",2020,"Mar",30,"Mon",1
1187645876224684032,"vp mike pence    nike stores in china actually removed their houston rockets merchandise from their shelves to join the chinese<u+2026>",2019-10-25 08:23:36,"Houston Rockets","Southwest",2019,"Oct",25,"Fri",8
1237008121182081024,"gt  gt   lt  vintage nike swingman nba new york knicks allan houston  20 jersey size xl<u+2026>",2020-03-09 13:31:33,"New York Knicks","Atlantic",2020,"Mar",9,"Mon",13
1192192348664451072,"in the 2020 21 nba season  the phoenix suns broke an all time jersey sales record      suns  nikebasketball  nike  nba   <u+0001f91e><u+2026>",2019-11-06 21:29:40,"Phoenix Suns","Pacific",2019,"Nov",6,"Wed",21
1319889659892174848,"travis scott has now done brand collaborations with     mcdonald<u+2019>s   playstation    fortnite    reese<u+2019>s puffs   nike    h<u+2026>",2020-10-24 06:33:11,"Houston Rockets","Southwest",2020,"Oct",24,"Sat",6
1319823400328638464,"travis scott has now done brand collaborations with     mcdonald<u+2019>s   playstation    fortnite    reese<u+2019>s puffs   nike    h<u+2026>",2020-10-24 02:09:54,"Houston Rockets","Southwest",2020,"Oct",24,"Sat",2
1319930608139763712,"travis scott has now done brand collaborations with     mcdonald<u+2019>s   playstation    fortnite    reese<u+2019>s puffs   nike    h<u+2026>",2020-10-24 09:15:54,"Houston Rockets","Southwest",2020,"Oct",24,"Sat",9
1303817170732945408,"nike air penny 5  orlando magic   get here   ad",2020-09-09 22:06:51,"Orlando Magic","Southeast",2020,"Sep",9,"Wed",22
1305694952018579456,"check out dallas mavericks luka doncic nike navy authentic statement jersey   size 56 2xl  nike",2020-09-15 02:28:29,"Dallas Mavericks","Southwest",2020,"Sep",15,"Tue",2
1250738381631389696,"the nets biggie collection is selling out fast at nike   <u+0001f4a5>  jersey  gt  logo tee red  gt",2020-04-16 10:50:42,"Brooklyn Nets","Atlantic",2020,"Apr",16,"Thu",10
1212882131715842048,"get 35  off the nike air flight 89   suns   + free shipping   buy here",2020-01-02 23:43:29,"Phoenix Suns","Pacific",2020,"Jan",2,"Thu",23
1210549883318521856,"new nike  nba brooklyn nets hyper elite shooting shirt men s 2xl tall $120 $54 00 end date  monday jan 27 2020 5 10<u+2026>",2019-12-27 13:15:57,"Brooklyn Nets","Atlantic",2019,"Dec",27,"Fri",13
1198846504871567360,"here<u+2019>s a video of my nike shoot   edit being played on the jumbotron at the la clippers game     worththefuckingstruggle ht<u+2026>",2019-11-25 06:10:54,"LA Clippers","Pacific",2019,"Nov",25,"Mon",6
1289045929786355712,"<u+0001f455>nike jayson tatum icon edition swingman  boston celtics   <u+0001f6d2> 3 100 thb  <u+0001fa73> sweeks <u+201c>logo<u+201d> dyed short  color black white  <u+0001f6d2>1<u+2026>",2020-07-31 03:51:13,"Boston Celtics","Atlantic",2020,"Jul",31,"Fri",3
1275192546113789952,"barzanikevin i don t follow basketball at all but i always liked boston celtics",2020-06-22 22:22:49,"Boston Celtics","Atlantic",2020,"Jun",22,"Mon",22
1319821802022031360,"travis scott has now done brand collaborations with     mcdonald<u+2019>s   playstation    fortnite    reese<u+2019>s puffs   nike    h<u+2026>",2020-10-24 02:03:33,"Houston Rockets","Southwest",2020,"Oct",24,"Sat",2
1262411781709926400,"michael jordan made $90 million in salary in the nba career   he now makes more than that every year from nike   he owns<u+2026>",2020-05-18 15:56:37,"Charlotte Hornets","Southeast",2020,"May",18,"Mon",15
1252584479366852608,"have you copped anything from the nike x biggie collection yet   <u+0001f60b>  jersey  gt  logo tee red  gt  ht<u+2026>",2020-04-21 13:06:26,"Brooklyn Nets","Atlantic",2020,"Apr",21,"Tue",13
1316740408077058048,"nike officially reveals the footwear and apparel for mamba week  includes the kobe v protro big stage  5x champ   undefeatedinc<u+2026>",2020-10-15 13:59:11,"LA Lakers","Pacific",2020,"Oct",15,"Thu",13
1262359541615910912,"michael jordan made $90 million in salary in the nba career   he now makes more than that every year from nike   he owns<u+2026>",2020-05-18 12:29:02,"Charlotte Hornets","Southeast",2020,"May",18,"Mon",12
1232133871946301440,"icymi  50  off + free shipping on the nike nba boston celtics city edition <u+201c>gordon hayward<u+201d> swingman jersey   buy here <u+2026>",2020-02-25 02:43:01,"Boston Celtics","Atlantic",2020,"Feb",25,"Tue",2
1283418329168990208,"ad  nike nba brooklyn nets biggie apparel dropped via dtlr = gt",2020-07-15 15:09:09,"Brooklyn Nets","Atlantic",2020,"Jul",15,"Wed",15
1257184281287254016,"from nike to chi town  the journey of marc eversley  the  chicagobulls  first black general manager   <u+2026>",2020-05-04 05:44:24,"Chicago Bulls","Central",2020,"May",4,"Mon",5
1208128915488808960,"nba  nikebasketball denver nuggets and detroit pistons  nbaxmas  sweepstakes",2019-12-20 20:55:54,"Detroit Pistons","Central",2019,"Dec",20,"Fri",20
1319798687120449536,"travis scott has now done brand collaborations with     mcdonald<u+2019>s   playstation    fortnite    reese<u+2019>s puffs   nike    h<u+2026>",2020-10-24 00:31:42,"Houston Rockets","Southwest",2020,"Oct",24,"Sat",0
1188081182581366784,"mike pence has accused nike of   checking its social conscience at the door   for removing houston rockets merchandise from its<u+2026>",2019-10-26 13:13:22,"Houston Rockets","Southwest",2019,"Oct",26,"Sat",13
1293849259163504640,"concours nba toronto raptors jersey 52 wins <u+2705>  nbachallengefr2  grizzliesfr  gagnez le maillot nike city edition de lowry <u+0001f9ec><u+2026>",2020-08-13 09:57:56,"Toronto Raptors","Atlantic",2020,"Aug",13,"Thu",9
1179786068180160512,"nike  nba milwaukee bucks player issue training vest reversible l rare aj4737 010",2019-10-03 15:51:32,"Milwaukee Bucks","Central",2019,"Oct",3,"Thu",15
1267519495293358080,"nike air penny 5 returning in orlando magic colorway",2020-06-01 18:12:51,"Orlando Magic","Southeast",2020,"Jun",1,"Mon",18
1309294283967561728,"leaked  photos of the new toronto  raptors uniform for the 2020 21 season   nba  nike   this is a full time multi seaso<u+2026>",2020-09-25 00:50:57,"Toronto Raptors","Atlantic",2020,"Sep",25,"Fri",0
1299555989130182656,"streetfashion nike youth brooklyn nets kevin durant  7 black dri fit swingman jersey  originally $75  now only  $6<u+2026>",2020-08-29 03:54:27,"Brooklyn Nets","Atlantic",2020,"Aug",29,"Sat",3
1254843585154805760,"kobe  nike  portland trail blazers  the dream team  like mike   episode 5 s my favorite so far",2020-04-27 18:43:19,"Portland Trail Blazers","Northwest",2020,"Apr",27,"Mon",18
1264160358505172992,"memphis grizzlies ja morant  12 jersey  nba  basketball  jersey  top vest  poshmark  nike  adidas  jordan size<u+ff1a>s xx<u+2026>",2020-05-23 11:44:51,"Memphis Grizzlies","Southwest",2020,"May",23,"Sat",11
1183011968346656768,"nike pulls houston rockets merch from stores in china  and social media erupts with condemnation",2019-10-12 13:30:07,"Houston Rockets","Southwest",2019,"Oct",12,"Sat",13
1182230552969019392,"framed al horford boston celtics autographed black nike swingman jersey  sportsmemorabilia<u+2026>",2019-10-10 09:45:03,"Boston Celtics","Atlantic",2019,"Oct",10,"Thu",9
1262231093878587392,"michael jordan made $90 million in salary in the nba career   he now makes more than that every year from nike   he owns<u+2026>",2020-05-18 03:58:38,"Charlotte Hornets","Southeast",2020,"May",18,"Mon",3
